{
  "kind": "system_backup_admin_operation_policy",
  "contract_version": "system-backup-plan.v12",
  "status": "draft",
  "middleware": ["Auth", "SetUserInfo", "NewAdminAuth"],
  "permissions": ["system_backup.read", "system_backup.operate", "system_backup.configure", "system_backup.security_configure", "system_backup.destructive"],
  "built_in_roles": {
    "viewer": ["system_backup.read"],
    "operator": ["system_backup.read", "system_backup.operate"],
    "config_admin": ["system_backup.read", "system_backup.configure"],
    "security_admin": ["system_backup.read", "system_backup.operate", "system_backup.configure", "system_backup.security_configure", "system_backup.destructive"]
  },
  "operations": [
    { "operation_id": "getSystemBackupOverview", "method": "GET", "path": "/admin/system-backup-overview", "required_permissions": ["system_backup.read"], "conditional_permissions": [], "recent_strong_auth": "none", "strong_auth_condition": null, "idempotency_required": false, "kill_switch": "allowed_when_disabled", "success_http_status": 200, "completion_mode": "synchronous" },
    { "operation_id": "getSystemBackupEvidence", "method": "GET", "path": "/admin/system-backup-evidence/{id}", "required_permissions": ["system_backup.read"], "conditional_permissions": [{ "when": "evidence_classification_confidential", "required_permissions": ["system_backup.operate"] }, { "when": "evidence_classification_sensitive", "required_permissions": ["system_backup.security_configure"] }], "recent_strong_auth": "conditional", "strong_auth_condition": "evidence_classification_confidential_or_sensitive", "idempotency_required": false, "idempotency_condition": "evidence_classification_confidential_or_sensitive", "kill_switch": "allowed_when_disabled", "success_http_status": 200, "completion_mode": "synchronous" },
    { "operation_id": "registerSystemBackupProviderProof", "method": "POST", "path": "/admin/system-backup-provider-proofs", "required_permissions": ["system_backup.destructive"], "conditional_permissions": [], "recent_strong_auth": "required", "strong_auth_condition": "always", "idempotency_required": true, "kill_switch": "allowed_when_disabled", "success_http_status": 201, "completion_mode": "synchronous" },
    { "operation_id": "getSystemBackupOperation", "method": "GET", "path": "/admin/system-backup-operations/{id}", "required_permissions": ["system_backup.read"], "conditional_permissions": [], "recent_strong_auth": "none", "strong_auth_condition": null, "idempotency_required": false, "kill_switch": "allowed_when_disabled", "success_http_status": 200, "completion_mode": "synchronous" },
    { "operation_id": "getSystemBackupConfig", "method": "GET", "path": "/admin/system-backup-config", "required_permissions": ["system_backup.read"], "conditional_permissions": [], "recent_strong_auth": "none", "strong_auth_condition": null, "idempotency_required": false, "kill_switch": "allowed_when_disabled", "success_http_status": 200, "completion_mode": "synchronous" },
    { "operation_id": "updateSystemBackupConfig", "method": "PUT", "path": "/admin/system-backup-config", "required_permissions": ["system_backup.configure"], "conditional_permissions": [{ "when": "config_security_boundary_change", "required_permissions": ["system_backup.security_configure"] }, { "when": "config_protection_reduction", "required_permissions": ["system_backup.destructive"] }], "recent_strong_auth": "conditional", "strong_auth_condition": "security_boundary_or_protection_reduction", "idempotency_required": true, "kill_switch": "allowed_when_disabled", "success_http_status": 200, "completion_mode": "synchronous" },
    { "operation_id": "listSystemBackupConfigVersions", "method": "GET", "path": "/admin/system-backup-config/versions", "required_permissions": ["system_backup.read"], "conditional_permissions": [], "recent_strong_auth": "none", "strong_auth_condition": null, "idempotency_required": false, "kill_switch": "allowed_when_disabled", "success_http_status": 200, "completion_mode": "synchronous" },
    { "operation_id": "getSystemBackupConfigVersion", "method": "GET", "path": "/admin/system-backup-config/versions/{version}", "required_permissions": ["system_backup.read"], "conditional_permissions": [], "recent_strong_auth": "none", "strong_auth_condition": null, "idempotency_required": false, "kill_switch": "allowed_when_disabled", "success_http_status": 200, "completion_mode": "synchronous" },
    { "operation_id": "rollbackSystemBackupConfig", "method": "POST", "path": "/admin/system-backup-config/rollback", "required_permissions": ["system_backup.configure"], "conditional_permissions": [{ "when": "config_security_boundary_change", "required_permissions": ["system_backup.security_configure"] }, { "when": "config_protection_reduction", "required_permissions": ["system_backup.destructive"] }], "recent_strong_auth": "conditional", "strong_auth_condition": "security_boundary_or_protection_reduction", "idempotency_required": true, "kill_switch": "allowed_when_disabled", "success_http_status": 200, "completion_mode": "synchronous" },
    { "operation_id": "listSystemBackupCatalogScans", "method": "GET", "path": "/admin/system-backup-catalog-scans", "required_permissions": ["system_backup.read"], "conditional_permissions": [], "recent_strong_auth": "none", "strong_auth_condition": null, "idempotency_required": false, "kill_switch": "allowed_when_disabled", "success_http_status": 200, "completion_mode": "synchronous" },
    { "operation_id": "createSystemBackupCatalogScan", "method": "POST", "path": "/admin/system-backup-catalog-scans", "required_permissions": ["system_backup.operate"], "conditional_permissions": [], "recent_strong_auth": "none", "strong_auth_condition": null, "idempotency_required": true, "kill_switch": "allowed_when_disabled", "success_http_status": 202, "completion_mode": "asynchronous" },
    { "operation_id": "getSystemBackupCatalogScan", "method": "GET", "path": "/admin/system-backup-catalog-scans/{id}", "required_permissions": ["system_backup.read"], "conditional_permissions": [], "recent_strong_auth": "none", "strong_auth_condition": null, "idempotency_required": false, "kill_switch": "allowed_when_disabled", "success_http_status": 200, "completion_mode": "synchronous" },
    { "operation_id": "listSystemBackupCatalogRecords", "method": "GET", "path": "/admin/system-backup-catalog-records", "required_permissions": ["system_backup.read"], "conditional_permissions": [], "recent_strong_auth": "none", "strong_auth_condition": null, "idempotency_required": false, "kill_switch": "allowed_when_disabled", "success_http_status": 200, "completion_mode": "synchronous" },
    { "operation_id": "getSystemBackupCatalogRecord", "method": "GET", "path": "/admin/system-backup-catalog-records/{id}", "required_permissions": ["system_backup.read"], "conditional_permissions": [], "recent_strong_auth": "none", "strong_auth_condition": null, "idempotency_required": false, "kill_switch": "allowed_when_disabled", "success_http_status": 200, "completion_mode": "synchronous" },
    { "operation_id": "listSystemBackupCatalogImports", "method": "GET", "path": "/admin/system-backup-catalog-imports", "required_permissions": ["system_backup.read"], "conditional_permissions": [], "recent_strong_auth": "none", "strong_auth_condition": null, "idempotency_required": false, "kill_switch": "allowed_when_disabled", "success_http_status": 200, "completion_mode": "synchronous" },
    { "operation_id": "createSystemBackupCatalogImport", "method": "POST", "path": "/admin/system-backup-catalog-imports", "required_permissions": ["system_backup.operate"], "conditional_permissions": [], "recent_strong_auth": "none", "strong_auth_condition": null, "idempotency_required": true, "kill_switch": "allowed_when_disabled", "success_http_status": 202, "completion_mode": "asynchronous" },
    { "operation_id": "getSystemBackupCatalogImport", "method": "GET", "path": "/admin/system-backup-catalog-imports/{id}", "required_permissions": ["system_backup.read"], "conditional_permissions": [], "recent_strong_auth": "none", "strong_auth_condition": null, "idempotency_required": false, "kill_switch": "allowed_when_disabled", "success_http_status": 200, "completion_mode": "synchronous" },
    { "operation_id": "verifyImportedSystemBackupArtifact", "method": "POST", "path": "/admin/system-backup-catalog-imports/{id}/verify-artifact", "required_permissions": ["system_backup.operate"], "conditional_permissions": [], "recent_strong_auth": "none", "strong_auth_condition": null, "idempotency_required": true, "kill_switch": "requires_effective_enabled", "success_http_status": 202, "completion_mode": "asynchronous" },
    { "operation_id": "createImportedSystemRestoreDrill", "method": "POST", "path": "/admin/system-backup-catalog-imports/{id}/restore-drills", "required_permissions": ["system_backup.operate"], "conditional_permissions": [], "recent_strong_auth": "none", "strong_auth_condition": null, "idempotency_required": true, "kill_switch": "requires_effective_enabled", "success_http_status": 202, "completion_mode": "asynchronous" },
    { "operation_id": "listSystemBackups", "method": "GET", "path": "/admin/system-backups", "required_permissions": ["system_backup.read"], "conditional_permissions": [], "recent_strong_auth": "none", "strong_auth_condition": null, "idempotency_required": false, "kill_switch": "allowed_when_disabled", "success_http_status": 200, "completion_mode": "synchronous" },
    { "operation_id": "createSystemBackup", "method": "POST", "path": "/admin/system-backups", "required_permissions": ["system_backup.operate"], "conditional_permissions": [], "recent_strong_auth": "none", "strong_auth_condition": null, "idempotency_required": true, "kill_switch": "requires_effective_enabled", "success_http_status": 202, "completion_mode": "asynchronous" },